### ISSUE TITLE
Only one of the function-pods serves a burst of requests if calling through the gateway

### ISSUE THREAD

**Issue by szefoka** [openfaas/faas#1018]
Only one function pod serves a burst of requests in case of using multiple function pods and calling the function through the gateway.

Using the following function with 2 replicas, only one of the pods serves the requests if calling it through the openfaas gateway. 
def handle(req):
    return "0"

I've checked it by watching the log-lines containing "Duration" of the function pods. I've also exec'd in one of the pods and changed the line return "0" to return "1".
If calling the function through the gateway the sum of the output of
for i in $(seq 1 100); do curl http://10.109.222.230:8080/function/myfunc1; done
is 100 or 0

However calling the function through the function's ClusterIP service, running 
for i in $(seq 1 100); do curl 10.102.79.126:8080; done
the sum of the output is about 50 (42 and 59 for two measurements)

## Expected Behaviour

The requests of the burst to be served should be distributed between the pods, however only one function pod works at a time when calling the function through the gateway.

## Current Behaviour

Only one function pod serves the burst of requests

## Steps to Reproduce (for bugs)

Deploy an OpenFaaS function by using the following function and set the number of replicas to 2.

def handle(req):
    return "0"

provider:
  name: faas
  gateway: http://127.0.0.1:8080
functions:
  myfunc1:
    lang: python
    handler: ./myfunc1
    image: local_docker_registry:5000/myfunc1
    labels:
      com.openfaas.scale.min: "2"
      com.openfaas.scale.max: "2"

List the function pods
kubectl get pods -n openfaas-fn | grep myfunc1
myfunc1-6f8c76c6db-25cfc   2/2     Running   0          148m
myfunc1-6f8c76c6db-psd6n   2/2     Running   0          148m

Exec into one of the pods and change the function's return value to 1.
kubectl exec -n openfaas-fn -it myfunc1-6f8c76c6db-psd6n sh
Use vi to edit the handler.py located in the function directory

Call the function through the OpenFaaS gateway.
To get the gateway IP and port run "kubectl get services -n openfaas gateway"
kubectl get services -n openfaas gateway
NAME      TYPE       CLUSTER-IP       EXTERNAL-IP   PORT(S)          AGE
gateway   NodePort   10.109.222.230   <none>        8080:31112/TCP   161m

Run 
for i in $(seq 1 100); do curl http://10.109.222.230:8080/function/myfunc1; done

Find the function pod's IP address and port by 
kubectl get services -n openfaas-fn
NAME      TYPE        CLUSTER-IP      EXTERNAL-IP   PORT(S)    AGE
myfunc1   ClusterIP   10.102.79.126   <none>        8080/TCP   157m

Run
for i in $(seq 1 100); do curl 10.102.79.126:8080; done

## Context
I would like to understand the load-balancing of OpenFaaS. As I understand the gateway's mechanism it only calls the service of the given function. However skipping this step and sending requests to the function directly through its ClusterIP service the behavior changes. This is unexpected for me as I think calling directly the function's service is equivalent to calling the function through the gateway (which then calls the function's service directly).
In the case when calling the function through the gateway I cannot see any load balancing during the burst.

## Your Environment

* FaaS-CLI version ( Full output from: `faas-cli version` ): 0.8.1

* Docker version `docker version` (e.g. Docker 17.0.05 ): 18.09.0

* Are you using Docker Swarm or Kubernetes (FaaS-netes)? Kubernetes

* Operating System and version (e.g. Linux, Windows, MacOS): Linux, 4.4.0-138-generic

**Comment by alexellis** [comment]
Hi thanks for your interest in the project.

> Using the following function with 2 replicas, only one of the pods serves the requests if calling it through the openfaas gateway.

I think your example might be slightly simpler to understand if you deployed something that echoed the hostname of the container from /etc/hosts instead of counting up integers. Can you try switching that out? How about using NodeInfo?

With NodeInfo I see the two different containers serving requests in an alternating pattern:



> I would like to understand the load-balancing of OpenFaaS. As I understand the gateway's mechanism it only calls the service of the given function

The load balancing in OpenFaaS is offloaded to the Kubernetes Service or the Swarm Service which does round-robin and readiness checking too.

If you have. function named A and two replicas, then the Kubernetes Service "A.openfaas-fn" will be invoked, the Service will each replicas roughly equally (example included below). If one replica gets removed or crashes it will be removed from the load-balancing pool.

Alex

PS: quick question.. how are you scaling the service? You can't do it manually, you must do it using OpenFaaS scaling labels otherwise it may get scaled back to the default amount which is 1/1 replicas. https://docs.openfaas.com/architecture/autoscaling/

```
alex@nuc7:~$ curl -s http://127.0.0.1:31111/function/nodeinfo|grep Hostname
Hostname: nodeinfo-6ff658f85d-8qb7t
alex@nuc7:~$ curl -s http://127.0.0.1:31111/function/nodeinfo|grep Hostname
Hostname: nodeinfo-6ff658f85d-8qb7t
alex@nuc7:~$ curl -s http://127.0.0.1:31111/function/nodeinfo|grep Hostname
Hostname: nodeinfo-6ff658f85d-6qbqk
alex@nuc7:~$ curl -s http://127.0.0.1:31111/function/nodeinfo|grep Hostname
Hostname: nodeinfo-6ff658f85d-6qbqk
alex@nuc7:~$ curl -s http://127.0.0.1:31111/function/nodeinfo|grep Hostname
Hostname: nodeinfo-6ff658f85d-8qb7t
alex@nuc7:~$ curl -s http://127.0.0.1:31111/function/nodeinfo|grep Hostname
Hostname: nodeinfo-6ff658f85d-8qb7t
alex@nuc7:~$ curl -s http://127.0.0.1:31111/function/nodeinfo|grep Hostname
Hostname: nodeinfo-6ff658f85d-8qb7t
alex@nuc7:~$ curl -s http://127.0.0.1:31111/function/nodeinfo|grep Hostname
Hostname: nodeinfo-6ff658f85d-8qb7t
alex@nuc7:~$ curl -s http://127.0.0.1:31111/function/nodeinfo|grep Hostname
Hostname: nodeinfo-6ff658f85d-6qbqk
alex@nuc7:~$ curl -s http://127.0.0.1:31111/function/nodeinfo|grep Hostname
Hostname: nodeinfo-6ff658f85d-6qbqk
alex@nuc7:~$ curl -s http://127.0.0.1:31111/function/nodeinfo|grep Hostname
Hostname: nodeinfo-6ff658f85d-6qbqk
alex@nuc7:~$ curl -s http://127.0.0.1:31111/function/nodeinfo|grep Hostname
Hostname: nodeinfo-6ff658f85d-8qb7t
alex@nuc7:~$ curl -s http://127.0.0.1:31111/function/nodeinfo|grep Hostname
Hostname: nodeinfo-6ff658f85d-8qb7t
alex@nuc7:~$ 
```

Given that I've shown this to be working as documented I will close the issue, but please keep commenting. If you can prove that the Kubernetes Service is not doing its job in a clear, concise, repeatable way then I'll re-open.

**Comment by LucasRoesler** [comment]
To really test this, try deploying this stack

```yaml
# stack.yml
provider:
  name: faas
  gateway: http://127.0.0.1:31112

functions:
  echohost:
    lang: dockerfile
    image: functions/alpine:latest
    fprocess: "hostname"
    skip_build: true
```

And then run this script

```bash
for i in `seq 1 100`;
do
    curl -s http://localhost:31112/function/echohost >> hostnames.txt
done 
sort hostnames.txt | uniq -c
```

this will actually collect the hostname from the function and then give you the count of hosts that were called along with the host name.

**Comment by szefoka** [comment]
Thanks for your reply, I have tried both of your suggestions.
When I was trying your solution @alexellis in which you called curl commands separately I got the kind of same result you had.
root@node1:/users/szefoka# curl -s http://localhost:31112/function/echohost 
echohost-5fbc49555d-fnfhc
root@node1:/users/szefoka# curl -s http://localhost:31112/function/echohost 
echohost-5fbc49555d-fnfhc
root@node1:/users/szefoka# curl -s http://localhost:31112/function/echohost 
echohost-5fbc49555d-4w9zg
root@node1:/users/szefoka# curl -s http://localhost:31112/function/echohost 
echohost-5fbc49555d-fnfhc
root@node1:/users/szefoka# curl -s http://localhost:31112/function/echohost 
echohost-5fbc49555d-4w9zg
root@node1:/users/szefoka# curl -s http://localhost:31112/function/echohost 
echohost-5fbc49555d-4w9zg
root@node1:/users/szefoka# curl -s http://localhost:31112/function/echohost 
echohost-5fbc49555d-fnfhc
root@node1:/users/szefoka# curl -s http://localhost:31112/function/echohost 
echohost-5fbc49555d-4w9zg
root@node1:/users/szefoka# curl -s http://localhost:31112/function/echohost 
echohost-5fbc49555d-fnfhc
root@node1:/users/szefoka# curl -s http://localhost:31112/function/echohost 
echohost-5fbc49555d-fnfhc
root@node1:/users/szefoka# curl -s http://localhost:31112/function/echohost 
echohost-5fbc49555d-4w9zg
root@node1:/users/szefoka# curl -s http://localhost:31112/function/echohost 
echohost-5fbc49555d-fnfhc

On the other hand when I tried the solution suggested by @LucasRoesler I got this:
root@node1:/users/szefoka# for i in `seq 1 100`; do     curl -s http://localhost:31112/function/echohost >> hostnames.txt; done 
root@node1:/users/szefoka# sort hostnames.txt | uniq -c
100 echohost-5fbc49555d-fnfhc

I actually modified the stack yaml, to have exactly 2 serving pods, as the original yaml supports only one pod in the beginning (and only if scaling happens it allows more pods) 

If inserting a sleep 0.1 after the curl command in the for loop I got the same result, but after increasing the sleep time to 0.2 I got this
52 echohost-5fbc49555d-4w9zg
48 echohost-5fbc49555d-fnfhc

For your PS question @alexellis I didn't do any scaling, I only set the number of serving pods to exactly 2, by setting the parameters com.openfaas.scale.min and com.openfaas.scale.max to 2 in the function yaml.
Thanks,
David

**Comment by szefoka** [comment]
I did some new measurements and I also found that the IdleTimeout value of the reverseProxy in gateway/server.go is set to 120 milliseconds in gateway/types/proxy_client.go.
Now my idea was that the gateway tears down the connection with the function pod after this IdleTimeout.
I have performed some measurements.
```
time for i in `seq 1 100`; do     curl -s http://10.109.222.230:8080/function/echohost >> hostnames.txt && sleep 0.106; done 

real	0m12.026s
user	0m0.288s
sys	0m0.140s
root@node1:/users/szefoka# sort hostnames.txt | uniq -c
100 echohost-5fbc49555d-fnfhc
```
Serving 100 requests takes about 12 seconds, so serving one request is about 120 milliseconds.
Increasing the sleeptime to 0.11
```
real	0m12.784s
user	0m0.268s
sys	0m0.148s

6 echohost-5fbc49555d-4w9zg
94 echohost-5fbc49555d-fnfhc
```
By further increasing the sleep time, the difference between the number of different hostnames is decreasing. 
I've also installed tcpdump on the gateway pod.
For one request I got this output.
```
14:11:38.064731 IP 10.44.0.2.58086 > 10.102.199.44.8080: Flags [S], seq 4239128929, win 26720, options [mss 1336,sackOK,TS val 28163741 ecr 0,nop,wscale 7], length 0
14:11:38.064792 IP 10.102.199.44.8080 > 10.44.0.2.58086: Flags [S.], seq 3643670009, ack 4239128930, win 26480, options [mss 1336,sackOK,TS val 28163741 ecr 28163741,nop,wscale 7], length 0
14:11:38.064825 IP 10.44.0.2.58086 > 10.102.199.44.8080: Flags [.], ack 1, win 209, options [nop,nop,TS val 28163741 ecr 28163741], length 0
14:11:38.064995 IP 10.44.0.2.58086 > 10.102.199.44.8080: Flags [P.], seq 1:285, ack 1, win 209, options [nop,nop,TS val 28163741 ecr 28163741], length 284: HTTP: GET / HTTP/1.1
14:11:38.065024 IP 10.102.199.44.8080 > 10.44.0.2.58086: Flags [.], ack 285, win 216, options [nop,nop,TS val 28163741 ecr 28163741], length 0
14:11:38.068206 IP 10.102.199.44.8080 > 10.44.0.2.58086: Flags [P.], seq 1:305, ack 285, win 216, options [nop,nop,TS val 28163742 ecr 28163741], length 304: HTTP: HTTP/1.1 200 OK
14:11:38.068217 IP 10.44.0.2.58086 > 10.102.199.44.8080: Flags [.], ack 305, win 218, options [nop,nop,TS val 28163742 ecr 28163742], length 0
14:11:38.188477 IP 10.44.0.2.58086 > 10.102.199.44.8080: Flags [F.], seq 285, ack 305, win 218, options [nop,nop,TS val 28163772 ecr 28163742], length 0
14:11:38.188645 IP 10.102.199.44.8080 > 10.44.0.2.58086: Flags [F.], seq 305, ack 286, win 216, options [nop,nop,TS val 28163772 ecr 28163772], length 0
```
Taking the timestamp of the SYN and the timestamp of the FIN packet the difference is about 120 ms.
188645 - 064731 = 123914 which is 123 ms.

I have also measured with repeated requests sleeping 0.2 sec between each. I got a similar output:
```
14:32:02.240505 IP 10.102.199.44.8080 > 10.44.0.2.47002: Flags [S.], seq 3386262139, ack 951913548, win 26480, options [mss 1336,sackOK,TS val 28469785 ecr 28469785,nop,wscale 7], length 0
14:32:02.240536 IP 10.44.0.2.47002 > 10.102.199.44.8080: Flags [.], ack 1, win 209, options [nop,nop,TS val 28469785 ecr 28469785], length 0
14:32:02.240694 IP 10.44.0.2.47002 > 10.102.199.44.8080: Flags [P.], seq 1:285, ack 1, win 209, options [nop,nop,TS val 28469785 ecr 28469785], length 284: HTTP: GET / HTTP/1.1
14:32:02.240716 IP 10.102.199.44.8080 > 10.44.0.2.47002: Flags [.], ack 285, win 216, options [nop,nop,TS val 28469785 ecr 28469785], length 0
14:32:02.244508 IP 10.102.199.44.8080 > 10.44.0.2.47002: Flags [P.], seq 1:305, ack 285, win 216, options [nop,nop,TS val 28469786 ecr 28469785], length 304: HTTP: HTTP/1.1 200 OK
14:32:02.244518 IP 10.44.0.2.47002 > 10.102.199.44.8080: Flags [.], ack 305, win 218, options [nop,nop,TS val 28469786 ecr 28469786], length 0
14:32:02.364709 IP 10.44.0.2.47002 > 10.102.199.44.8080: Flags [F.], seq 285, ack 305, win 218, options [nop,nop,TS val 28469816 ecr 28469786], length 0
14:32:02.364816 IP 10.102.199.44.8080 > 10.44.0.2.47002: Flags [F.], seq 305, ack 286, win 216, options [nop,nop,TS val 28469816 ecr 28469816], length 0
14:32:02.364832 IP 10.44.0.2.47002 > 10.102.199.44.8080: Flags [.], ack 306, win 218, options [nop,nop,TS val 28469816 ecr 28469816], length 0
14:32:02.455866 IP 10.44.0.2.47006 > 10.102.199.44.8080: Flags [S], seq 897958785, win 26720, options [mss 1336,sackOK,TS val 28469839 ecr 0,nop,wscale 7], length 0
14:32:02.455916 IP 10.102.199.44.8080 > 10.44.0.2.47006: Flags [S.], seq 4109219434, ack 897958786, win 26480, options [mss 1336,sackOK,TS val 28469839 ecr 28469839,nop,wscale 7], length 0
14:32:02.455939 IP 10.44.0.2.47006 > 10.102.199.44.8080: Flags [.], ack 1, win 209, options [nop,nop,TS val 28469839 ecr 28469839], length 0
14:32:02.456095 IP 10.44.0.2.47006 > 10.102.199.44.8080: Flags [P.], seq 1:285, ack 1, win 209, options [nop,nop,TS val 28469839 ecr 28469839], length 284: HTTP: GET / HTTP/1.1
14:32:02.456119 IP 10.102.199.44.8080 > 10.44.0.2.47006: Flags [.], ack 285, win 216, options [nop,nop,TS val 28469839 ecr 28469839], length 0
14:32:02.458211 IP 10.102.199.44.8080 > 10.44.0.2.47006: Flags [P.], seq 1:305, ack 285, win 216, options [nop,nop,TS val 28469839 ecr 28469839], length 304: HTTP: HTTP/1.1 200 OK
14:32:02.458222 IP 10.44.0.2.47006 > 10.102.199.44.8080: Flags [.], ack 305, win 218, options [nop,nop,TS val 28469839 ecr 28469839], length 0
14:32:02.578532 IP 10.44.0.2.47006 > 10.102.199.44.8080: Flags [F.], seq 285, ack 305, win 218, options [nop,nop,TS val 28469869 ecr 28469839], length 0
14:32:02.578702 IP 10.102.199.44.8080 > 10.44.0.2.47006: Flags [F.], seq 305, ack 286, win 216, options [nop,nop,TS val 28469869 ecr 28469869], length 0
```
SYN and FIN timestamp differences are also about 120ms.
But when I decreased the sleep time to 0.1 I got a different output:
```
14:34:08.492963 IP 10.44.0.2.48774 > 10.102.199.44.8080: Flags [S], seq 3298955117, win 26720, options [mss 1336,sackOK,TS val 28501348 ecr 0,nop,wscale 7], length 0
14:34:08.493047 IP 10.102.199.44.8080 > 10.44.0.2.48774: Flags [S.], seq 2771911362, ack 3298955118, win 26480, options [mss 1336,sackOK,TS val 28501348 ecr 28501348,nop,wscale 7], length 0
14:34:08.493085 IP 10.44.0.2.48774 > 10.102.199.44.8080: Flags [.], ack 1, win 209, options [nop,nop,TS val 28501348 ecr 28501348], length 0
14:34:08.493247 IP 10.44.0.2.48774 > 10.102.199.44.8080: Flags [P.], seq 1:285, ack 1, win 209, options [nop,nop,TS val 28501348 ecr 28501348], length 284: HTTP: GET / HTTP/1.1
14:34:08.493269 IP 10.102.199.44.8080 > 10.44.0.2.48774: Flags [.], ack 285, win 216, options [nop,nop,TS val 28501348 ecr 28501348], length 0
14:34:08.497378 IP 10.102.199.44.8080 > 10.44.0.2.48774: Flags [P.], seq 1:305, ack 285, win 216, options [nop,nop,TS val 28501349 ecr 28501348], length 304: HTTP: HTTP/1.1 200 OK
14:34:08.497388 IP 10.44.0.2.48774 > 10.102.199.44.8080: Flags [.], ack 305, win 218, options [nop,nop,TS val 28501349 ecr 28501349], length 0
14:34:08.608340 IP 10.44.0.2.48774 > 10.102.199.44.8080: Flags [P.], seq 285:569, ack 305, win 218, options [nop,nop,TS val 28501377 ecr 28501349], length 284: HTTP: GET / HTTP/1.1
14:34:08.609454 IP 10.102.199.44.8080 > 10.44.0.2.48774: Flags [P.], seq 305:609, ack 569, win 224, options [nop,nop,TS val 28501377 ecr 28501377], length 304: HTTP: HTTP/1.1 200 OK
14:34:08.609469 IP 10.44.0.2.48774 > 10.102.199.44.8080: Flags [.], ack 609, win 226, options [nop,nop,TS val 28501377 ecr 28501377], length 0
14:34:08.721079 IP 10.44.0.2.48774 > 10.102.199.44.8080: Flags [P.], seq 569:853, ack 609, win 226, options [nop,nop,TS val 28501405 ecr 28501377], length 284: HTTP: GET / HTTP/1.1
14:34:08.722235 IP 10.102.199.44.8080 > 10.44.0.2.48774: Flags [P.], seq 609:913, ack 853, win 232, options [nop,nop,TS val 28501405 ecr 28501405], length 304: HTTP: HTTP/1.1 200 OK
14:34:08.722252 IP 10.44.0.2.48774 > 10.102.199.44.8080: Flags [.], ack 913, win 234, options [nop,nop,TS val 28501405 ecr 28501405], length 0
14:34:08.833419 IP 10.44.0.2.48774 > 10.102.199.44.8080: Flags [P.], seq 853:1137, ack 913, win 234, options [nop,nop,TS val 28501433 ecr 28501405], length 284: HTTP: GET / HTTP/1.1
14:34:08.834764 IP 10.102.199.44.8080 > 10.44.0.2.48774: Flags [P.], seq 913:1217, ack 1137, win 241, options [nop,nop,TS val 28501433 ecr 28501433], length 304: HTTP: HTTP/1.1 200 OK
14:34:08.834785 IP 10.44.0.2.48774 > 10.102.199.44.8080: Flags [.], ack 1217, win 243, options [nop,nop,TS val 28501433 ecr 28501433], length 0
14:34:08.945370 IP 10.44.0.2.48774 > 10.102.199.44.8080: Flags [P.], seq 1137:1421, ack 1217, win 243, options [nop,nop,TS val 28501461 ecr 28501433], length 284: HTTP: GET / HTTP/1.1
14:34:08.946605 IP 10.102.199.44.8080 > 10.44.0.2.48774: Flags [P.], seq 1217:1521, ack 1421, win 249, options [nop,nop,TS val 28501461 ecr 28501461], length 304: HTTP: HTTP/1.1 200 OK
14:34:08.946622 IP 10.44.0.2.48774 > 10.102.199.44.8080: Flags [.], ack 1521, win 251, options [nop,nop,TS val 28501461 ecr 28501461], length 0
14:34:09.066899 IP 10.44.0.2.48774 > 10.102.199.44.8080: Flags [F.], seq 1421, ack 1521, win 251, options [nop,nop,TS val 28501491 ecr 28501461], length 0
14:34:09.067013 IP 10.102.199.44.8080 > 10.44.0.2.48774: Flags [F.], seq 1521, ack 1422, win 249, options [nop,nop,TS val 28501492 ecr 28501491], length 0
```
In this last case I could observe that there's no time to reach the IdleTimeout between the requests. 

Conclusion:
I assume that requests coming in faster than 120ms are served by a function pod, which can be a bottleneck in case of a high load.

**Comment by alexellis** [comment]
From the Golang docs:

```
        // IdleConnTimeout is the maximum amount of time an idle
        // (keep-alive) connection will remain idle before closing
        // itself.
        // Zero means no limit.
        IdleConnTimeout time.Duration // Go 1.7
```

https://golang.org/pkg/net/http/

There are many variables that can be tuned via the transport. https://golang.org/src/net/http/transport.go?s=3628:10127#L93

Something like Weave Cloud may help with network visualisation or the open-source version Weave Scope.

I wonder if `curl` and `while` is a suitable performance testing/load-generation tool?

Have you thought about using `hey`? We use that quite a bit in the project for testing.

https://github.com/rakyll/hey

```
go get -u github.com/rakyll/hey
hey -c 10 -n 200 -q 10 -m=POST -d="data" http://remote-gateway-ip/function/name
```

The `-q` factor limits the max QPS.

Alex

**Comment by alexellis** [comment]
The `hey` tool may give a better indication of a production workload than curl combined with `while` since it manages keep alives differently. Altering the keep-alive behaviour in the proxy may increase the amount of DNS lookups in the cluster which can cause Kubernetes DNS to crash under high load so we need to be careful here and do thorough testing around any tweaking that is done.

Please feel free to look into altering the `http.Transport` values and doing some additional experimentation. I would just ask that you try this with `hey` rather than `bash`. We are also interested to see if there is an issue that would manifest in a real-world, production scenario.

Alex

**Comment by szefoka** [comment]
Hi,
I have tried the hey tool. In my current setup I am using a deployment with two replicas described by the below yaml.
```
provider:
  name: faas
  gateway: http://127.0.0.1:31112

functions:
  echohost:
    lang: dockerfile
    image: functions/alpine:latest
    fprocess: "hostname"
    labels:
      com.openfaas.scale.min: "2"
      com.openfaas.scale.max: "2"
```
I have issued the hey command below
`hey -c 1 -n 200 -q 100  http://localhost:31112/function/echohost`

By watching the appropriate veth ports of the function pods I could see that the traffic was routed to only one of the pods. Since Kuberntes uses round-robin load-balancing the traffic should have been routed to both of the pods. However watching the two function-pod's interfaces with tcpdump only one instanse of tcpdump shows output during one running of hey.

Increasing the concurrency level to 2 (as I have two replicas) I could see that the load was distributed between the pods, but sometimes all the requests were routed to only one of the pods.

An interesting output, or maybe just for me is the following.
tcpdump on functionpod A
```
06:31:51.498630 IP 10.44.0.10.34984 > 10.44.0.19.http-alt: Flags [S], seq 1968008446, win 26720, options [mss 1336,sackOK,TS val 92148664 ecr 0,nop,wscale 7], length 0
06:31:51.498631 IP 10.44.0.10.34986 > 10.44.0.18.http-alt: Flags [S], seq 3940658031, win 26720, options [mss 1336,sackOK,TS val 92148664 ecr 0,nop,wscale 7], length 0
06:31:51.498727 IP 10.44.0.18.http-alt > 10.44.0.10.34986: Flags [S.], seq 332326432, ack 3940658032, win 26480, options [mss 1336,sackOK,TS val 92148664 ecr 92148664,nop,wscale 7], length 0
06:31:51.498795 IP 10.44.0.10.34986 > 10.44.0.18.http-alt: Flags [.], ack 1, win 209, options [nop,nop,TS val 92148664 ecr 92148664], length 0
06:31:51.498932 IP 10.44.0.10.34986 > 10.44.0.18.http-alt: Flags [P.], seq 1:295, ack 1, win 209, options [nop,nop,TS val 92148664 ecr 92148664], length 294: HTTP: GET / HTTP/1.1
06:31:51.498944 IP 10.44.0.18.http-alt > 10.44.0.10.34986: Flags [.], ack 295, win 216, options [nop,nop,TS val 92148664 ecr 92148664], length 0
06:31:51.499844 IP 10.44.0.18.http-alt > 10.44.0.10.34986: Flags [P.], seq 1:158, ack 295, win 216, options [nop,nop,TS val 92148664 ecr 92148664], length 157: HTTP: HTTP/1.1 200 OK
06:31:51.506041 IP 10.44.0.10.34986 > 10.44.0.18.http-alt: Flags [P.], seq 295:589, ack 158, win 218, options [nop,nop,TS val 92148666 ecr 92148664], length 294: HTTP: GET / HTTP/1.1
```

tcpdump on functionpod B
```
06:31:51.498619 IP 10.44.0.10.34984 > 10.44.0.19.http-alt: Flags [S], seq 1968008446, win 26720, options [mss 1336,sackOK,TS val 92148664 ecr 0,nop,wscale 7], length 0
06:31:51.498619 IP 10.44.0.10.34986 > 10.44.0.18.http-alt: Flags [S], seq 3940658031, win 26720, options [mss 1336,sackOK,TS val 92148664 ecr 0,nop,wscale 7], length 0
06:31:51.498727 IP 10.44.0.19.http-alt > 10.44.0.10.34984: Flags [S.], seq 2943598742, ack 1968008447, win 26480, options [mss 1336,sackOK,TS val 92148664 ecr 92148664,nop,wscale 7], length 0
06:31:51.498795 IP 10.44.0.10.34984 > 10.44.0.19.http-alt: Flags [.], ack 1, win 209, options [nop,nop,TS val 92148664 ecr 92148664], length 0
06:31:51.498933 IP 10.44.0.10.34984 > 10.44.0.19.http-alt: Flags [P.], seq 1:295, ack 1, win 209, options [nop,nop,TS val 92148664 ecr 92148664], length 294: HTTP: GET / HTTP/1.1
06:31:51.498943 IP 10.44.0.19.http-alt > 10.44.0.10.34984: Flags [.], ack 295, win 216, options [nop,nop,TS val 92148664 ecr 92148664], length 0
06:31:51.499850 IP 10.44.0.19.http-alt > 10.44.0.10.34984: Flags [P.], seq 1:158, ack 295, win 216, options [nop,nop,TS val 92148664 ecr 92148664], length 157: HTTP: HTTP/1.1 200 OK
06:31:51.506002 IP 10.44.0.10.34984 > 10.44.0.19.http-alt: Flags [P.], seq 295:589, ack 158, win 218, options [nop,nop,TS val 92148666 ecr 92148664], length 294: HTTP: GET / HTTP/1.1
```
What I wanna point out here is that both of the pods receive both of the SYN packets to build up a connection, so the kubernetes service forwards both connection initialization requests to both of the pods. And the watchdog instances are somehow decide to which SYN they want to reply and with which gateway port they want to communicate. 
But I am wondering how do the gateway decide to start a new thread with which it is able to communicate to the function. 

As I see this, the gateway connects to the watchdog instance running in the function-pod, or in other words it uses the IP of the service of the function, however it builds up an HTTP connection with the watchdog and keeps it alive till IdleConnTimeout.

Another test.
Taking that the default IdleConnTimeout is 120ms the value of -q in hey should be 8 to exceed the timeout between two queries (1 sec / 0.12 sec = 0.8333).
Issuing the below and watching tcpdump on both veth ports we can see that both tcpdump outputs the traffic.
`hey -c 1 -n 200 -q 8  http://localhost:31112/function/echohost`
But increasing the value of -q to 9 to be sure not to exceed the timeout between the requests only one of the tcpdumps will output anything.
`hey -c 1 -n 200 -q 9  http://localhost:31112/function/echohost`

To reproduce this:

To get the veth port of the function pod run
`docker ps | grep <functionname> | grep pause`
Take the first 7 characters of the container's ID and run
`brctl show | grep <first 7 chars of ID>`
In my case (in a kubernetes cluster of two nodes)
```
docker ps | grep echohost | grep pause
0d483ac00bc1        k8s.gcr.io/pause:3.1               "/pause"                 4 days ago          Up 4 days                                    k8s_POD_echohost-565bdbdbb5-xgvdf_openfaas-fn_8ed70dcd-14c6-11e9-adb9-98f2b3cca290_0
af3b5874ae3b        k8s.gcr.io/pause:3.1               "/pause"                 4 days ago          Up 4 days                                    k8s_POD_echohost-565bdbdbb5-zwhfs_openfaas-fn_8bb205a4-14c6-11e9-adb9-98f2b3cca290_0

root@node2:~# brctl show | grep 0d483ac
vethwepl0d483ac
root@node2:~# brctl show | grep af3b587
vethweplaf3b587
```
Anyways, is there any reason that you have chosen 120ms for the timeout value?
Or is it an appropriate value to not to overload the kubedns service? As service IPs are permanent, the gateway could store them instead of querying the kubedns repeatedly. But it might be a bit out of scope now.

Thanks,
David
